ID,Category,Aircraft,System,SubSystem,Question,OptionA,OptionB,OptionC,OptionD,CorrectAnswer,Explanation,Reference,Difficulty,Tags,TimesSeen,TimesCorrect,TimesWrong,LastSeen,LastCorrect,UserFlag
85,Type Rating,A330,Avionics,Displays/Warnings,"After an engine failure on T/O, the sideslip indicator will:",Change to green .,Change to blue .,Change to yellow .,Change to magenta .,B,,,,"ecam,avionics",0,0,0,,,
86,Type Rating,A330,Flight Controls,FCS,"If the angle of attack is greater than alpha prot , when the sidestick is released:",The angle of attack reduces to alpha prot .,The angle of attack remains the same .,The speed returns to VLS .,The aircraft cannot fly at an angle greater than alpha prot .,A,,,,fcs,0,0,0,,,
87,Type Rating,A330,Air Systems,Bleed/Pneumatics,Can  the IP valve position be controlled directly through the 20  air bleed cockpit panel?,"Yes , by turning up the pack temperature .",No .,Yes .,"Yes, directly by turning down the pack temperature .",A,,,,"bleed,pneumatic",0,0,0,,,
88,Type Rating,A330,Avionics,Displays/Warnings,"On  the ECAM PRESS page, an outflow valve indicator changes to amber if :",It is open more than 95% in flight .,It is fully closed .,It is not fully open on the ground .,It is fully open in flight .,A,,,,"ecam,avionics",0,0,0,,,
89,Type Rating,A330,,,What  is the approximate wingspan of the aircraft?,200 ft / 60m  A330 -300 .,2 30 ft / 6 8m.,180 ft / 55m .,190 ft / 58m  A330 -200 .,A,,,,,0,0,0,,,
90,Type Rating,A330,Landing Gear,Gear & NWS,"With  both green and yellow hydraulic systems lost, manual pitch trim (stabilizer) is:",Only available until the landing gear is down .,Available .,Lost .,Only available after the landing gear is down .,A,,,,"landinggear,nws",0,0,0,,,
91,Type Rating,A330,Avionics,Displays/Warnings,"On  the ECAM PRESS page, the safety valve indication changes to amber if:",Both safety valves do not open .,One safety valve is open .,At least one safety valve is not fully closed .,Both safety valves are fully open . 21,C,,,,"ecam,avionics",0,0,0,,,
92,Type Rating,A330,Air Systems,Bleed/Pneumatics,"If  APU bleed is ON, during climbing APU bleed valve closes when the altitude is:",23000 ft .,25000 ft .,20000 ft .,22500 ft .,B,,,,"bleed,pneumatic",0,0,0,,,
93,Type Rating,A330,Air Systems,Pressurization,In case of single hydraulic system low pressure:,The master caution light illuminates and the single chime Sounds .,There is no warning .,The master warning light illuminates .,The emergency warning light illuminates and the CRC Sounds .,A,,,,pressurization,0,0,0,,,
94,Type Rating,A330,Fuel,Fuel System,"Excluding  the vent surge tanks, how many tanks are in each wing?",Three .,Two .,Five .,Four .,B,,,,fuel,0,0,0,,,
95,Type Rating,A330,Landing Gear,Gear & NWS,"During  approach, MASTER WARN, red arrow and GEAR NOT DOWN on ECAM:","Indicates landing gear nor down locked, flaps  at 2, 3 or FULL and radio height is lower  than 750 ft .",Indicates landing gear down locked and flaps at FULL .,Indicates landing gear not down locked  and both engines not at TOGA .,Would not be triggered by either (A) or (B) .,A,,,,"landinggear,nws",0,0,0,,,
96,Type Rating,A330,Electrical,Power Supply,"On  ground, yellow ELEC pushbutton at AUTO, the yellow 22  electric pump runs:","With one engine  running, provided the blue pump pushbutton has been pressed .",Whenever both engines are running .,During cargo door operation .,If ground electrical power is on .,C,,,,electrical,0,0,0,,,
97,Type Rating,A330,Fuel,Fuel System,The  normal tank filling order is:,Inner tanks then outer tanks .,Surge tanks first .,All tanks filled simultaneously as required by fuel load .,Outer tanks then inner tanks .,C,,,,fuel,0,0,0,,,
98,Type Rating,A330,,,Normally  the anti -skid system reference speed is determined by:,The ADIRUs through BSCU .,A wheel tachometer .,The LGCIUs .,The BSCUs .,A,,,,,0,0,0,,,
99,Type Rating,A330,Brakes,Braking,Is it permissible to use air conditioning packs and LP ground units simultaneously?,"Yes, if external temperature is greater than 50°C . Yes, in all cases .","Yes, provided the airflow supplied by the ground cart is less than 1.2 kg/s . Yes, provided the aircraft is stationary . 23               C) No.",No.,Yes . 100 ) Is the autobrake deactivated when the PARK BRK handle is moved to ON? Both (A) and (B) are correct . 1,C,,,,"brakes,antiskid",0,0,0,,,
100,Type Rating,A330,Brakes,Braking,Is the autobrake deactivated when the PARK BRK handle is moved to ON?,"Yes, in all cases .","Yes, provided the aircraft is stationary .",No.,Both (A) and (B) are correct .,C,,,,"brakes,antiskid",0,0,0,,,
101,Type Rating,A330,,,What is the length of the A330's wingspan?,63.69m.,60.3m.,66.3m.,63.3m.,A,,,,,0,0,0,,,
102,Type Rating,A330,Landing Gear,Gear & NWS,What is the maximum nose wheel turning angle and what is the minimum turning width for a 180º turn?  (A330 -300).,"72º, 48 m.","68º, 28 m","75º, 48 m.",None of these are correct.,A,,,,"landinggear,nws",0,0,0,,,
103,Type Rating,A330,Doors/Emergency,Cabin Safety,How do you open the evacuation and release board of the cockpit door  from the cockpit side ?,Kick from one side of the cockpit.,The board falls off automatically in case of rapid cabin decompression.,Both A and B.,,C,,,,"doors,emergency",0,0,0,,,
104,Type Rating,A330,Autoflight/FMGS,FMGS,"Pilot inadvertently activates the approach phase in cruising, how to reactivate the cruise phase?",Cruise phase cannot be reactivated. One.,Pull the speed knob on FCU. Two.,Let the A/C climb to a higher flight level. Three.,Reselect a cruise flight level into the progress page. 2  05: How many working modes does FMGC have? Four.,D,,,,"fmgs,autoflight",0,0,0,,,
105,Type Rating,A330,Autoflight/FMGS,FMGS,How many working modes does FMGC have?,One.,Two.,Three.,Four.,B,,,,"fmgs,autoflight",0,0,0,,,
106,Type Rating,A330,Autoflight/FMGS,FMGS,"If pilot inserts non-ILS approach in flight plan, and then tunes ILS frequency on the RAD NAV page, what will the MCDU display?",CHECK APPR SELECTION .,RWY -ILS MISMATCH.,CHECK DESTINATION DATA.,None.,B,,,,"fmgs,autoflight",0,0,0,,,
107,Type Rating,A330,Hydraulics,Hydraulic Systems,"In SRS mode, what is the target speed the A/C maintains in one engine inoperative?",V2.,V2+10.,V2+15.,"V2 or current A/C speed, which one is higher (no more than V2+15).",D,,,,hydraulics,0,0,0,,,
108,Type Rating,A330,Limitations/Performance,Limitations,In normal law the auto trim is frozen when:,Dual stick input is made.,The auto trim is never frozen.,When the load factor is higher than 1.3g.,In high speed protection. 3,D,,,,"limitations,performance",0,0,0,,,
109,Type Rating,A330,Electrical,Power Supply,During a rejected takeoff above 72 kts :,"If ground spoilers are armed, they will extend as soon as all thrust levers are set to idle.","If ground spoilers are not armed, they will extend as soon as reverse is selected on at least one engine (remaining engine at idle) .",A and B are correct .,"Ground spoilers will not deploy until reverse is selected on at least one engine, regardless of the position of the speedbrake control lever.",C,,,,electrical,0,0,0,,,
110,Type Rating,A330,Hydraulics,Hydraulic Systems,The hydraulic reservoir pressurization comes from :,HP (High Pressure) bleed air from engine one .,LP (Low Pressure) bleed air from engine one.,"A is correct and in case the bleed air pressure is too low, the system takes it from the crossbleed duct.","B is correct and in case the bleed air pressure is too low, the system takes it from the other engine.",C,,,,hydraulics,0,0,0,,,
111,Type Rating,A330,Communications,Radio,In EMER ELEC CONFIG:,Only RMP 1 is available.,Only RMP 2 is available.,Only RMP 3 is available.,RMP 1 and RMP 2 are available.,A,,,,comms,0,0,0,,,
112,Type Rating,A330,Landing Gear,Gear & NWS,What happens to the various cabin lights in the event of excessive cabin altitude ?,The cabin lights and all the cabin signs (except the NO PORTABLE ELEC DEVICE signs) come on automatically only if the switches are in the AUTO position.,The cabin lights and all the cabin signs (except the NO PORTABLE ELEC DEVICE signs) come on automatically  only if the EMER EXIT switch is in the ARM position. 4  C: The cabin lights and all the cabin signs (except the NO PORTABLE ELEC DEVICE signs) come on automatically only if the landing gear is down.,,The cabin lights and all the cabin signs (except the NO PORTABLE ELEC DEVICE signs) come on automatically regardless of the position of the switches.,A,,,,"landinggear,nws",0,0,0,,,
113,Type Rating,A330,Air Systems,Pressurization,What does an amber RAT indication mean  on the HYD page ?,The RAT is stowed.,The RAT is not stowed and the RPM is below 3000 RPM.,The RAT is pressurizing the right half of the GREEN system.,,B,,,,pressurization,0,0,0,,,
114,Type Rating,A330,Flight Controls,FCS,"In the event of low hydraulic pressure, a priority valve cuts off power to heavy users. They are:","Emergency generator, landing gear and nose wheel steering.","Landing gear, inbound ailerons and rudder.","Nose wheel steering, flaps and slats.","Flaps, slats and landing gear.",D,,,,fcs,0,0,0,,,
115,Type Rating,A330,Communications,Radio,Which SEL indicator comes on in amber when VHF1is tuned BY RMP2?,Only  RMP1.,Only RMP 2.,Both RMP1 and RMP2.,None.,C,,,,comms,0,0,0,,,
116,Type Rating,A330,Flight Controls,FCS,The YELLOW hydraulic system electric pump:,Runs automatically in the event of engine 2 failure if flaps lever is not at cero.,"Runs automatically in the event of any engine failure for 25 seconds, when the landing gear lever is selected up.",Runs automatically in the event of engine 1 failure + PRIM 1 or PRIM 3 failure to ensure sufficient authority on the electrical rudder. 5,,A,,,,fcs,0,0,0,,,
117,Type Rating,A330,Avionics,Displays/Warnings,Will EMER EVAC be activated in cabin when the CAPT and PURS/CAPT sw are in the position of CAPT?,It will be activated only in the cabin.,Will be activated only in the cockpit.,"It will be activated first in the cockpit, then in the cabin.","If one of the cabin EVAC CMD keys is pressed, only the cockpit horn sounds for 3 s .",D,,,,"ecam,avionics",0,0,0,,,
118,Type Rating,A330,Hydraulics,Hydraulic Systems,The RAT automatically extends in flight in case of:,Both engines failure.,GREEN + BLUE LO LVL.,GREEN + YELLOW LO LVL.,All are correct.,D,,,,hydraulics,0,0,0,,,
119,Type Rating,A330,Electrical,Power Supply,"At takeoff (or go around), what is the minimum recommended speed at which the SLATS may be retracted from CONF 1 + F to CONF 0?",Green dot speed.,S speed.,F speed.,Vls speed.,B,,,,electrical,0,0,0,,,
120,Type Rating,A330,Electrical,Power Supply,"During a manual start, what function does the FADEC perform?",The FADEC does not perform any function during a manual start and all actions have to be carry out by the pilots.,To control the start sequence and take corrective action in case of failure or malfunction.,"Passive monitoring of the start sequence, to close the start valve and cut off the ignition on the ground.",The FADEC does not work until idle is reached . 6,C,,,,electrical,0,0,0,,,
121,Type Rating,A330,Fire Protection,Fire/Smoke,"With reference to the engine fire protection system, which statement is correct?",Each engine has single fire bottle which is also connected to the other engine.,Each engine is equipped with two fire bottles.,Both engines have a single fire protection loop.,Engine fire warnings are only shown on the FIRE panel.,B,,,,fire,0,0,0,,,
122,Type Rating,A330,Electrical,Power Supply,The engine ANTI ICE system… :,"When selected ON, causes idle N1 (or idle EPR) to be reduced.",Cannot be operated on ground to prevent damaging the slats.,Operates only in flight and is fully automatic in case of icing conditions.,Is controlled manually by the pilot through the ENGI 1 and ENG 2 anti -ice pb.,D,,,,electrical,0,0,0,,,
123,Type Rating,A330,Electrical,Power Supply,"With the AUDIO SWITCHING knob in the CAPT ON 3 position, the Captain uses his acoustic equipment on ACP 3.",The AUDIO SWITCHING knob must be place in ALTN position .,No ACP 3 available for A330.,TRUE.,The AUDIO SWITCHING knob must be place in STBY position.,C,,,,electrical,0,0,0,,,
124,Type Rating,A330,Hydraulics,Hydraulic Systems,During your preliminary cockpit preparation you notice that the FLAPS lever is in the ZERO position but the E/WD shows the FLAPS extended. What should you do?,Switch ON the YELLOW electric HYD pump and recycle the FLAPS lever.,Do nothing. The FLAPS will move to the position selected as soon as all the engines will be started.,You must move the FLAPS to the position corresponding to the position shown on the E/WD.,You must check with the maintenance crew before applying hydraulic power. 7,D,,,,hydraulics,0,0,0,,,
125,Type Rating,A330,Electrical,Power Supply,"The control surfaces are electrically controlled, but are there any that have a mechanical backup?","Yes, the THS.","Yes, the elevators and rudder.","Yes, the elevators and ailerons.","No, they all required some electrical power.",A,,,,electrical,0,0,0,,,
126,Type Rating,A330,Flight Controls,FCS,"In Normal Law, if one side stick is rapidly pulled fully back, can the aircraft’s maximum allowable “G” load be exceeded?","No. At maximum “G” load, the side sticks are de -activated for 5 seconds.",Yes. Until maximum pitch attitude is reached the alpha floor protection is active.,Yes. Rapid side stick deflection must never be made.,No. The load factor protection overrides side stick commands to avoid excessive “G” loads.,D,,,,fcs,0,0,0,,,
127,Type Rating,A330,Electrical,Power Supply,If both pilots deflect simultaneously their side sticks fully back…,The “pitch up” order is 1.5 times higher than with only one stick deflected.,The “pitch up” order is equal to a single stick deflection.,No inputs are sent to the flight control computers unless one pilot presses the take over pb on his stick.,The “pitch up” order is twice as high as with only one stick deflected.,B,,,,electrical,0,0,0,,,
128,Type Rating,A330,Landing Gear,Gear & NWS,What does the NWS DISC memo on the E/WD indicate?,There is a discrepancy between the two nose wheel steering hand wheel positions.,A failure in the nose wheel steering system has been detected.,The nose wheel steering has been disconnected by ground personnel.,The nose wheel steering computer has finished its self -test. Nose wheel steering is now available. 8,B,,,,"landinggear,nws",0,0,0,,,
129,Type Rating,A330,Avionics,Displays/Warnings,There are two triangles for each gear on the ECAM WHEEL page. What do they represent?,Each triangle represents one of the braking systems available for that gear.,Each triangle represents the position detected by one of the two LGCIUs.,Each triangle represents one wheel on the gear .,The front triangle indicates the position of that gear and the back triangle indicates the status of the brakes of that gear.,C,,,,"ecam,avionics",0,0,0,,,
130,Type Rating,A330,Hydraulics,Hydraulic Systems,What is the normal operating pressure in the hydraulic system?,2.000 psi.,1.000 psi.,500 psi.,3.000 psi.,B,,,,hydraulics,0,0,0,,,
131,Type Rating,A330,Hydraulics,Hydraulic Systems,The aircraft is on the ground and the PROBE/WINDOW HEAT is ON. All the probes are heated except for:,Total Air Temperature (TAT) probes.,Static ports.,Angle of attack (AOA) probes.,"A is correct, in addition pitot heating operates at low level.",D,,,,hydraulics,0,0,0,,,
132,Type Rating,A330,Electrical,Power Supply,"With reference to the PROBE/WINDOW HEAT pb, what is the correct statement?",The system should only be selected ON in icing conditions.,"When in AUTO mode, the windows are heated only when necessary.",The blue light indicates that probes are heated (except TAT and windows on ground).,"Window heating comes ON automatically after the first engine start, whichever the pb position. 9",A,,,,electrical,0,0,0,,,
133,Type Rating,A330,Hydraulics,Hydraulic Systems,Two identical FWCs generate :,"Alert messages, radio height callouts, decision height callouts, landing speed increments.",The system display pages and Engine/Warning display pages.,Only red warnings.,Only amber cautions and red warnings.,D,,,,hydraulics,0,0,0,,,
134,Type Rating,A330,Avionics,Displays/Warnings,The purpose of any of the three DMCs (Display Management Computer) is:,"Acquire data, then generate signals.",Obtain data from the different sensors and computers and  send it to the display units (DU’s).,Generate decision height callouts.,All are correct.,A,,,,"ecam,avionics",0,0,0,,,
135,Type Rating,A330,Avionics,Displays/Warnings,The communications loudspeakers announce aural alerts and voice messages.,It requires the loudspeakers to be ON.,It requires the loudspeakers to be ON and the batteries p/b to be connected.,It does NOT require the loudspeaker to be ON.,None is correct.,B,,,,"ecam,avionics",0,0,0,,,
136,Type Rating,A330,Avionics,Displays/Warnings,The upper ECAM DU has failed and you want to check the DOOR/OXY page. How can you display it?,You have to press and hold the DOOR/OXY pb on the ECP.,You have to move the ECAM DMC selector to position 1.,You have to press and hold the RCL pb on the ECP.,It is not possible to see the DOOR/OXY page with this failure.,C,,,,"ecam,avionics",0,0,0,,,
137,Type Rating,A330,Avionics,Displays/Warnings,Both ECAM screens have failed. Is it possible to get the E/WD indications?,"Yes, the E/WD is automatically transferred to one of the ND ’s. 10  B: No, the E/WD is lost until the FWS can be repaired.",,"Yes, to get the E/WD information it must be manually transferred, using the ECAM/ND XFR on the ECAM SWITCHING panel.","Yes, the E/WD information is automatically transferred to the F/O ’s PFD in the event of an ECAM warning.",A,,,,"ecam,avionics",0,0,0,,,
138,Type Rating,A330,Avionics,Displays/Warnings,The message “CHECK EWD” indicates that:,An EGT OVERLIMIT has been detected.,A N1 overlimit has been detected .,The DMC (Display Management Computer) detects a discrepancy between the parameters obtained by the DMC and the operational parameters displayed on the DU (Display unit).,None of the above.,A,,,,"ecam,avionics",0,0,0,,,
139,Type Rating,A330,Flight Controls,FCS,According to the failure “ NAV ADR DISAGREE ” select the correct answer:,It is an independent failure.,It is a primary failure.,It is a secondary failure.,It is only a advisory.,C,,,,fcs,0,0,0,,,
140,Type Rating,A330,Avionics,Displays/Warnings,"If the ECAM control panel fails, how can the pilot view a particular system page?",Hold the “ALL” button down until the page of interest comes up and then release the button.,Hold the “STS” button down until the page of interest comes up and then release the button.,Hold the “RCL” button down until the page of interes t comes up and then release the button.,The pilot cannot view the system.,B,,,,"ecam,avionics",0,0,0,,,
141,Type Rating,A330,Hydraulics,Hydraulic Systems,What is the speed limit for operating the windscreen wipers?,230 kts.,185 kts. 11  C: 200 kts.,,215 kts.,B,,,,hydraulics,0,0,0,,,
142,Type Rating,A330,Limitations/Performance,Limitations,Maximum demonstrated crosswind for takeoff and landing is 40 kt (gust included).,No limitation in icing conditions.,False.,True.,No limitation.,A,,,,"limitations,performance",0,0,0,,,
143,Type Rating,A330,Flight Controls,FCS,The maximum altitude with flaps and/or slats extended is:,10.000 ft.,No limitation.,25.000 ft.,20.000 ft.,B,,,,fcs,0,0,0,,,
144,Type Rating,A330,Landing Gear,Gear & NWS,The maximum altitude at which the landing gear may be extended is:,No limitation.,31.000 ft.,21.000 ft.,10.000 ft.,D,,,,"landinggear,nws",0,0,0,,,
145,Type Rating,A330,Landing Gear,Gear & NWS,What is the maximum speed for landing gear hydraulic pressure supply?,280kt .,250kt.,260kt.,285kt.,A,,,,"landinggear,nws",0,0,0,,,
146,Type Rating,A330,Limitations/Performance,Limitations,The maximum speed for speedbrakes use is:,250 kt in clean configuration. 12  B: MMO/VMO.,,.86/350.,No limitation.,A,,,,"limitations,performance",0,0,0,,,
147,Type Rating,A330,Fuel,Fuel System,The minimum fuel quantity for takeoff is:,No limitation.,2.500 kg.,5.200 kg.,15.200 kg.,B,,,,fuel,0,0,0,,,
148,Type Rating,A330,Electrical,Power Supply,Takeoff at reduced thrust is permitted on contaminated runways…,True.,Above ISA -5ºC.,False.,Only in CONF 1+F.,C,,,,electrical,0,0,0,,,
149,Type Rating,A330,Electrical,Power Supply,"Concerning the recording system, select the correct answer (aircraft on ground):",It is active during the first 5 min after the aircraft electric network is energized.,It is active after the first engine start and stops 5 min after the second engine shuts down.,The crew can manually start the recording system by pressing the GND CTL pushbutton.,All are correct.,C,,,,electrical,0,0,0,,,
150,Type Rating,A330,Air Systems,Pressurization,The A 330 is equipped with ____ static pressure probes and _____ angle of attack sensors:,6 and 3.,4 and 3.,6 and 4.,4 and 4.,D,,,,pressurization,0,0,0,,,
151,Type Rating,A330,,,"IR alignment has counted down, but IRS IN ALIGN flashes in GREEN. 13  Why is it?",Normal IRS alignment is in progress.,IRS alignment is faulty.,Engines are running during the IRS alignment.,Fast alignment is in progress.,A,,,,,0,0,0,,,
152,Type Rating,A330,Electrical,Power Supply,"Concerning the BUSS (BACK UP SPEED SCALE) pushbutton, select the correct answer:","Once it is pushed, it is irreversible.",Each pb independently commands the display of the BUSS on its associated side.,The BKUP SPD/ALT information is displayed only if flight level is below 250.,The BUSS information is based on the IRS.,C,,,,electrical,0,0,0,,,
153,Type Rating,A330,Hydraulics,Hydraulic Systems,The flight crew can use the BUSS (BACK UP SPEED SCALE):,Above FL250.,Below FL250.,At any altitude.,Only in clean configuration.,B,,,,hydraulics,0,0,0,,,
154,Type Rating,A330,Electrical,Power Supply,The data received from the GPS:,Overrides the information supplied by ADIRS.,Is transferred to the ADIRU.,"Once the ADIRU has the data, it performs the GPS -IRS hybrid position calculation which is used by the FMGEC.",B and C are correct .,B,,,,electrical,0,0,0,,,
155,Type Rating,A330,Hydraulics,Hydraulic Systems,The BACKUP CONTROL MODULE (BCM):,The BCM will grant direct RUDDER command with pedals.,The BCM provides yaw damping.,Is an independent unit with its own generator.,All are correct. 14,D,,,,hydraulics,0,0,0,,,
156,Type Rating,A330,Electrical,Power Supply,Flashing RELIEF message is displayed when:,The FLRS (Flap Load Relief System) has retracted the flaps to the next retracted lever position because VFE has been exceeded.,If speed is reduced below VFR -2.5 kt flaps return to their normal (selected) position.,"A is correct and FLRS is available whenever the Flap/Slats lever is position 2, 3 or FULL.",All are correct.,D,,,,electrical,0,0,0,,,
157,Type Rating,A330,Avionics,Displays/Warnings,"In case of a double FWC failure, MASTER CAUTION light, aural warnings and ECAM cautions and warnings are lost.",False.,ECAM cautions and warnings are never lost.,MASTER CAUTION light is still available.,True.,D,,,,"ecam,avionics",0,0,0,,,
158,Type Rating,A330,Electrical,Power Supply,"If HDG/TRK is engaged, the guidance does not consider any F - PLN constrain. Therefore if the pilot disengage NAV, CLB mode reverts to OP CLB.",Only in DIRECT LAW.,True.,False.,Only in ALTERNATE LAW.,D,,,,electrical,0,0,0,,,
159,Type Rating,A330,Air Systems,Pressurization,Pushing DITCHING pb cuts off _______.,"The outflow valves, the emergency RAM AIR inlet, the avionics ventilation inlet and extract valves, and the pack flow control valves.",The outflow valves and the emergency RAM AIR inlet.,The outflow valves and the pack flow control valves.,,B,,,,pressurization,0,0,0,,,
160,Type Rating,A330,Autoflight/FMGS,FMGS,The flight guidance function is _____.,"AP, Flight Plan, Auto Thrust.","AP, Performance, Auto Thrust.","AP, Flight Director , Auto Thrust. 15  D: AP, Flight Management, Auto Thrust.",,A,,,,"fmgs,autoflight",0,0,0,,,
161,Type Rating,A330,Hydraulics,Hydraulic Systems,"If all main generators fail, EMER GEN is inoperative during flight. The static converter supplies _____.",AC ESS.,AC 1 and AC 2.,AC LAND RECOVERY .,Both A and C.,C,,,,hydraulics,0,0,0,,,
162,Type Rating,A330,Fuel,Fuel System,"If there is an imbalance between the left and right wing tanks by more than ______, the quantity display pulses in the inner and outer tanks.",4000 kg .,3000 kg .,2000 kg .,1000 kg .,D,,,,fuel,0,0,0,,,
163,Type Rating,A330,Fuel,Fuel System,"On the ground, the Aft APU pump provides fuel from the trim pipe for the first minute(s)  ______ of APU operation.",One.,Two.,Three.,Four.,B,,,,fuel,0,0,0,,,
164,Type Rating,A330,Hydraulics,Hydraulic Systems,"In normal operation, automatic CG control","Begins during climb to FL245, ends at descent to FL 255 or when FMGC time to destination is less than 35 minutes.","Begins during climb to FL255, ends at descent to FL 245 or when FMGC time to destination is less than 35 minutes.","Begins during climb to FL255, ends at descent to FL 245 or when FMGC time to the destination  is less than 75 minutes.","Begins during climb to FL245, ends at decent to FL 255 or when FMGC time 16       to the destination  is less than 75 minutes.",A,,,,hydraulics,0,0,0,,,
165,Type Rating,A330,Fuel,Fuel System,"If fuel tank pump pb set on OFF position, the fault light:",Is inhibited.,Comes on when the delivery pressure drops.,Both A and B.,None.,B,,,,fuel,0,0,0,,,
166,Type Rating,A330,Fuel,Fuel System,The maximum fuel quantity for A330 -300 is:,About 70500 kg.,About 109000 kg.,About 138200 kg.,About 125500 kg,B,,,,fuel,0,0,0,,,
