ID,Category,Aircraft,System,SubSystem,Question,OptionA,OptionB,OptionC,OptionD,CorrectAnswer,Explanation,Reference,Difficulty,Tags,TimesSeen,TimesCorrect,TimesWrong,LastSeen,LastCorrect,UserFlag
167,Type Rating,A330,Fuel,Fuel System,When the jettison system is damping fuel in flight:,Output rate is approximately 1000kg per minute excluding fuel burn.,Output rate is approximately 3000kg per minute excluding fuel burn.,Output rate is approximately 500kg per minute excluding fuel burn.,Output rate is approximately 1000kg per hour excluding fuel burn.,B,,,,fuel,0,0,0,,,
168,Type Rating,A330,,,"The flight mode changes to flare mode, when A/C descents passing:",50 ft.,75 ft.,55 ft.,100 ft .,A,,,,,0,0,0,,,
169,Type Rating,A330,Electrical,Power Supply,"In normal operation, the trimmable  horizontal stabilizer:",Is driven by one of the three electrical motors.,Is driven by three electrical motors.,Is driven by the first of the two electrical motors.,Is driven by the two of the three electrical motors. 17,C,,,,electrical,0,0,0,,,
170,Type Rating,A330,Flight Controls,FCS,"In normal operation, the elevator and stabilizer is controlled by:",PRIM1 .,PRIM2 .,SEC1 .,SEC2 .,A,,,,fcs,0,0,0,,,
171,Type Rating,A330,Electrical,Power Supply,In the normal rudder electrical control:,"PRIM1 controls blue hydraulic jack, PRIM2 controls green hydraulic jack, PRIM3 controls the yellow  hydraulic jack .","PRIM1 controls yellow hydraulic jack, PRIM2 controls green hydraulic jack, PRIM3 controls blue hydraulic jack.","PRIM1 controls green hydraulic jack, PRIM2 controls blue hydraulic jack, PRIM3 controls the yellow hydraulic jack.",None  of them.,A,,,,electrical,0,0,0,,,
172,Type Rating,A330,Flight Controls,FCS,What is the purpose of LAND RECOVERY pb?,To release RAT manually.,"To inhibit RAT, extend slats for landing.",It is the necessary system to recover approach and landing.,Let ILS and slats and flaps connect to APU BAT for landing.,A,,,,fcs,0,0,0,,,
173,Type Rating,A330,Avionics,Displays/Warnings,In flight the left seat captain pushes the takeover pb and maintains and the right seat first officer pushes  the sidestick unintentionally. What will happen?,The priority green light of both sides illuminates  the arrow red light illuminates on the right side.,"The priority green light on the left side illuminates, the arrow red light illuminates on the right side.","The priority red arrow light of left side illuminates, the priority green light 18        illuminates on the right side.",,C,,,,"ecam,avionics",0,0,0,,,
174,Type Rating,A330,Flight Controls,FCS,A/C is turning with 45º bank angle. What will happen if the pilot releases the sidestick?,The bank angle maintains 45 º.,The bank angle automatically reduces to 33º.,The bank angle automatically reduces to 25 º.,The bank angle automatically reduces to 0.,B,,,,fcs,0,0,0,,,
175,Type Rating,A330,Hydraulics,Hydraulic Systems,Which two hydraulic systems are there driving slats?,Green and Yellow.,Green and Blue.,Blue and Yellow.,,B,,,,hydraulics,0,0,0,,,
176,Type Rating,A330,Hydraulics,Hydraulic Systems,"In normal operation, the data for ADIRU aligning is from.",ADIRU CDU .,ACMS .,FCU .,MCDU .,B,,,,hydraulics,0,0,0,,,
177,Type Rating,A330,Navigation,Nav/Surveillance,"Normally, GPS1 receiver provide information to:",ADIRU1.,ADIRU1 and ADIRU2.,"ADIRU1 , ADIRU2 and ADIRU3.",ADIRU1 and ADIRU3.,D,,,,nav,0,0,0,,,
178,Type Rating,A330,Navigation,Nav/Surveillance,“TCAS REDUCE RANGE” displayed on ND when:,"TA or RA is detected, and the ND range is above 10 NM.","TA is detected, and the ND range is above 20 NM .","TA or RA is detected, and the ND range is above 40 NM.","RA is detected, and the ND range is above 10 NM.",A,,,,nav,0,0,0,,,
179,Type Rating,A330,Hydraulics,Hydraulic Systems,The aural alert for excessively rate of decent warning is: 19  A: Sink rate - Pull up.,,Terrain.,Glide slope.,Pull up.,C,,,,hydraulics,0,0,0,,,
180,Type Rating,A330,Navigation,Nav/Surveillance,How many weather radars are installed in the aircraft?,One.,Two.,Three.,Four.,A,,,,nav,0,0,0,,,
181,Type Rating,A330,Hydraulics,Hydraulic Systems,G P W S  a u r a l  a l e r t  “ D O N ' T  S I N K ”  s o u n d e d  w h e n  i s d e t e c t e d .,Excessive deviation below glide slope.,Altitude loss after take -off.,Excessive terrain closure rate.,Excessive rate of descent.,B,,,,hydraulics,0,0,0,,,
182,Type Rating,A330,Avionics,Displays/Warnings,Wind shear alert is inhibited:,At takeoff above 100kt and up to 50ft.,At takeoff from 80kt till lift off 5 seconds and during landing below 100ft.,During landing below 50ft.,Both A and C.,B,,,,"ecam,avionics",0,0,0,,,
183,Type Rating,A330,Electrical,Power Supply,During your preliminary checks you set the ADIRS to align. The ON BAT light comes on. Why is this?,It is a reminder that the alignment is carried out using battery power.,Comes on for a few seconds to test the battery circuit.,It is a reminder that it is necessary to turn on the aircraft batteries.,It is an indication that there is a fault with the battery circuit.,D,,,,electrical,0,0,0,,,
184,Type Rating,A330,Air Systems,Pressurization,"Pressurization control is fully automatic, consists of two 20  outflow valves:","Each valve has 2 motors (1 automatic,1 manual).","E a c h  v a l v e  h a s  3  m o t o r s  ( 2  a u t o m a t i c , 1  m a n u a l ) .","Each valve has 3 motors (1 automatic,2 manual).",Each valve has 1 motor (automatic).,A,,,,pressurization,0,0,0,,,
185,Type Rating,A330,Avionics,Displays/Warnings,What appears on ECAM CAB PRESS page when cab alt between 8800ft and 9550ft?,The digital presentation pulses.,The analog and digital presentations appear in amber.,The analog and digital presentations appear in red.,Nothing.,B,,,,"ecam,avionics",0,0,0,,,
186,Type Rating,A330,Air Systems,Pressurization,The MAX. NORM. CABIN ALT. is:,8000,9550,14000,8800,A,,,,pressurization,0,0,0,,,
187,Type Rating,A330,Air Systems,Air Conditioning,Temperature regulation is controlled by:,One zone controller .,One zone controller and two pack controllers.,Two pack controllers.,Two zone controllers and two pack controllers.,A,,,,aircond,0,0,0,,,
188,Type Rating,A330,Avionics,Displays/Warnings,On which page of ECAM can you monitor the position of outflow valve?,AIR COND.,BLEED.,CAB PRESS.,B or C. 21,B,,,,"ecam,avionics",0,0,0,,,
189,Type Rating,A330,Electrical,Power Supply,"If LDG ELEV is set to AUTO, the LDG ELEV data sends to controller from:",FCU.,ADIRS.,FMGS.,,C,,,,electrical,0,0,0,,,
190,Type Rating,A330,Air Systems,Pressurization,The TRIM AIR valves:,Optimize the zone temperature by adding cold air.,Optimize the zone temperature by adding hot air.,Optimize the zone temperature by adjusting hot air pressure.,None  of them.,C,,,,pressurization,0,0,0,,,
191,Type Rating,A330,Flight Controls,FCS,The maximum altitude with flaps and/or slats extended is:,10000 ft.,15000 ft.,18000 ft.,20000 ft.,B,,,,fcs,0,0,0,,,
192,Type Rating,A330,Air Systems,Pressurization,The minimum engine oil pressure of the RR engine is:,40 psi.,20 psi.,25 psi.,30 psi.,D,,,,pressurization,0,0,0,,,
193,Type Rating,A330,Fuel,Fuel System,How many pumps are there in each wing tank?,Three pumps in each wing tank.,"There are no fuel pumps, since fuel tank is air pressurized.",One pump in each wing tank.,Two pumps are shared by all fuel tanks. 22,C,,,,fuel,0,0,0,,,
194,Type Rating,A330,Landing Gear,Gear & NWS,Maximum speed for landing gravity extension and maximum tyre speed  respectively are:,200kt and 204kt .,204kt and 205kt.,200kt and 209kt.,None of them.,A,,,,"landinggear,nws",0,0,0,,,
195,Type Rating,A330,Air Systems,Pressurization,The maximum cabin positive differential pressure is:,8.86 psi.,9.25 psi.,8.60 psi.,9.00 psi .,A,,,,pressurization,0,0,0,,,
196,Type Rating,A330,Electrical,Power Supply,How is standby engine data displayed?,On the pilot side ND.,On the F/O side ND.,On either ND after placing EFIS control knob to the ENG position.,On either ND after placing EFIS control knob to the STD BY position.,B,,,,electrical,0,0,0,,,
197,Type Rating,A330,Hydraulics,Hydraulic Systems,The RR TRENT -700 engine is a :,Single -rotor high bypass ratio turbofan engine.,Dual -rotor high bypass ratio turbofan engine.,Triple -rotor high bypass ratio turbofan engine.,Triple -rotor high bypass ratio turbojet engine. 23,C,,,,hydraulics,0,0,0,,,
198,Type Rating,A330,Fuel,Fuel System,"During automatic start on the ground, start valve closes when:",N3 is above 50% with N3 between 25% and 30% ignition occurs and HP fuel valve open .,N3 is above 50% with N3 above 30% ignition occurs and 40% HP fuel valve open.,N3 is above 50% with N3 above 40% ignition occurs and HP fuel valve Open.,Mode selector is set to NORM with N3 above 25% ignition occurs and 40% HP fuel valve open.,C,,,,fuel,0,0,0,,,
199,Type Rating,A330,Air Systems,Bleed/Pneumatics,The reverser is actuated by:,"Hydraulic actuators: green for engine 1, yellow for engine 2.",Hydraulic actuators: blue for both engines.,"Hydraulic actuators: blue for engine 1, yellow for engine 2.",Pneumatic actuators.,A,,,,"bleed,pneumatic",0,0,0,,,
200,Type Rating,A330,Avionics,Displays/Warnings,Which of the statement about FADEC system is correct?,"FADEC has two -channel redundancy, with one channel active and one in standby.",FADEC has two -channel redundancy and the two -channel working synchronously.,FADEC has one -channel.,None  of them.,A,,,,"ecam,avionics",0,0,0,,,
